{"card_bundle":"bundle:synthetic-v1","decks":[{"deck_id":"deck-a","digest":"0000000000000000000000000000000000000000000000000000000000000000","player":"1"},{"deck_id":"deck-b","digest":"1111111111111111111111111111111111111111111111111111111111111111","player":"2"}],"engine_build":"git:0000000","format_policy_snapshot":"commander:synthetic-v1","initial_state_digest":"0000000000000000000000000000000000000000000000000000000000000000","initial_state_revision":"0","kernel":{"build_profile":"test","implementation_id":"mtgml-reference","semantic_version":"0.2.2"},"oracle_snapshot":"oracle:synthetic-v1","randomness":{"algorithm_id":"counter-test","derivation_version":"v1","root_seed_hex":"2222222222222222222222222222222222222222222222222222222222222222"},"rules_snapshot":"cr:synthetic-v1","schema_version":"replay-manifest.v1","schemas":{"decision":"player-decision-request.v1","decision_response":"decision-response.v1","information_state":"information-state-envelope.v1","observation":"observation-envelope.v1","observed_event":"observed-event-envelope.v1","player_step":"player-step.v1","replay_step":"replay-step.v1"}}